{"authority_boundary":{"authority_effect":"none","changes_release_authority":false,"creates_device_control_authority":false,"creates_release_decision":false},"carrier_contract":{"archive_comment":"forbidden","archive_format":"zip","archive_member_set":"exact_payload_paths_plus_manifest_and_package_signature","carrier_identity_location":"verifier_report_only","compression_method":"stored","crc32":"required_and_verified","data_descriptors":"forbidden","directory_entries":"forbidden","duplicate_member_names":"forbidden","encrypted_members":"forbidden","extra_fields":"forbidden","file_extension":".pulseledger","local_central_directory_consistency":"required","max_carrier_bytes":33554432,"max_member_bytes":16777216,"max_total_uncompressed_bytes":33554432,"member_comments":"forbidden","member_name_encoding":"ASCII","member_name_policy":"relative_posix_no_dot_segments_no_backslash_no_nul","member_order_semantics":"not_authority_bearing_exact_carrier_hash_records_instance_order","non_regular_members":"forbidden","symlinks":"forbidden","timestamp_policy":"fixed_1980_01_01_00_00_00","trailing_data":"forbidden","zip64":"forbidden"},"claim_boundary":{"causal_completion_claim":"none","continuous_monitoring_claim":"none","device_security_claim":"none","external_validation_claim":"none","malware_claim":"none","physical_measurement_claim":"none"},"created_unix_ns":1700000000013000000,"document_type":"pulsemech_device_ledger_manifest","ledger_binding":{"checkpoint_record_sha256":"16f309c033f43a4b80d5cd0be3e0685af977ab510a0813c5fb32631b3334b2ff","ledger_id":"device-ledger:iphone-synthetic-reference-v0","ledger_member_path":"ledger/pulsemech_device_transition_ledger_v0.json","ledger_schema_member_path":"schemas/pulsemech_device_transition_ledger_v0.schema.json","ledger_schema_sha256":"58eddf75d9c89fef4aa3787e3e4db4d86624f4a387b2a33a3c2fd1f972d6c07f","ledger_sha256":"360de3b74e2c0ec33525426cd0598b5a8d382e8017295900f0ef5600ae9a4f77","ledger_size_bytes":31904,"record_count":14,"terminal_record_sha256":"16f309c033f43a4b80d5cd0be3e0685af977ab510a0813c5fb32631b3334b2ff"},"manifest_contract":{"canonicalization":"pulsemech_device_canonical_json_v0","digest_algorithm":"SHA-256","digest_subject":"exact_canonical_manifest_bytes","manifest_path":"manifest/pulsemech_device_ledger_manifest_v0.json","manifest_self_inventory":"excluded_to_avoid_circularity","package_signature_inventory":"excluded_to_avoid_circularity","package_signature_path":"signatures/package-signature-v0.json"},"observer_binding":{"fingerprint_algorithm":"SHA-256","fingerprint_subject":"exact_65_byte_x963_uncompressed_public_key","observer_public_key_fingerprint_sha256":"f2880825cd3caa7272d01042829e5b02e8a168db11225477b039e6ec9a7d09c6","public_key_encoding":"x963_uncompressed","public_key_member_path":"keys/observer-public-key-v0.bin","public_key_size_bytes":65,"signature_suite":"ecdsa-p256-sha256"},"package_format":"pulseledger_zip_v0","package_member_count":10,"payload_member_count":8,"payload_members":[{"byte_identity":"exact_member_bytes","media_type":"application/json","path":"contracts/pulsemech_device_canonical_json_v0.json","role":"canonicalization_profile","sha256":"ddc0e677e04c8678c32e36d21dc79ad509fe6c4a5507322abb6187c6e88c7550","size_bytes":2719},{"byte_identity":"exact_member_bytes","media_type":"application/json","path":"contracts/pulsemech_ios_observation_contract_v0.json","role":"ios_observation_contract","sha256":"e537fa04a7fb9e84292a2275e2818cb2012a66867bcd09d3ad3a8ff6cb7767c2","size_bytes":9893},{"byte_identity":"exact_member_bytes","media_type":"application/octet-stream","path":"keys/observer-public-key-v0.bin","role":"observer_public_key","sha256":"f2880825cd3caa7272d01042829e5b02e8a168db11225477b039e6ec9a7d09c6","size_bytes":65},{"byte_identity":"exact_member_bytes","media_type":"application/json","path":"ledger/pulsemech_device_transition_ledger_v0.json","role":"transition_ledger","sha256":"360de3b74e2c0ec33525426cd0598b5a8d382e8017295900f0ef5600ae9a4f77","size_bytes":31904},{"byte_identity":"exact_member_bytes","media_type":"application/schema+json","path":"schemas/pulsemech_device_ledger_manifest_v0.schema.json","role":"ledger_manifest_schema","sha256":"bf8126db9a9c5c40f1dbe3ad835ae7711a98d77fa8b3a59016f4ebd406d0ce3d","size_bytes":19913},{"byte_identity":"exact_member_bytes","media_type":"application/schema+json","path":"schemas/pulsemech_device_signature_v0.schema.json","role":"signature_schema","sha256":"80304b08b73f3c05092909e7917240af94121e2c15b9305440a7e01460c049c0","size_bytes":5031},{"byte_identity":"exact_member_bytes","media_type":"application/schema+json","path":"schemas/pulsemech_device_transition_ledger_v0.schema.json","role":"transition_ledger_schema","sha256":"58eddf75d9c89fef4aa3787e3e4db4d86624f4a387b2a33a3c2fd1f972d6c07f","size_bytes":54069},{"byte_identity":"exact_member_bytes","media_type":"application/json","path":"signatures/checkpoint-signature-v0.json","role":"checkpoint_signature","sha256":"2b8de3ae948dfe0693900f4ba83a17a15ab39a80b8ecd37a9c22a1e60c705605","size_bytes":1252}],"record_status":"synthetic_reference","reference_device_class":"iphone","reference_platform":"ios","schema_version":"pulsemech_device_ledger_manifest_v0","signature_contract":{"checkpoint_signature_path":"signatures/checkpoint-signature-v0.json","checkpoint_signed_object_type":"checkpoint_record_sha256","package_signature_path":"signatures/package-signature-v0.json","package_signature_subject":"SHA-256_of_exact_canonical_manifest_bytes","package_signed_object_type":"ledger_manifest_sha256","signature_schema_member_path":"schemas/pulsemech_device_signature_v0.schema.json","signature_schema_sha256":"80304b08b73f3c05092909e7917240af94121e2c15b9305440a7e01460c049c0","signature_suite":"ecdsa-p256-sha256"}}